{
  "schema_version": 1,
  "locale": "en-US",
  "window_title": "Gravebound — Core Identity",
  "brand_header": "GRAVEBOUND  /  CORE IDENTITY",
  "wipe_warning": "WIPEABLE TEST IDENTITY — SERVER RESTART CLEARS THIS ROSTER",
  "phases": {
    "boot": "BOOT",
    "patch_check": "PATCH CHECK",
    "authenticating": "AUTHENTICATING",
    "roster_loading": "CHARACTER SELECT — LOADING",
    "roster_empty": "CHARACTER SELECT — EMPTY",
    "roster_ready": "CHARACTER SELECT — READY",
    "character_creation": "CHARACTER CREATION",
    "creating": "CREATING CHARACTER",
    "selecting": "SELECTING CHARACTER",
    "selected": "CHARACTER SELECTED",
    "disconnected": "DISCONNECTED — RETRYING",
    "disabled": "CORE IDENTITY UNAVAILABLE",
    "error": "REQUEST FAILED — RETRY AVAILABLE"
  },
  "status_template": "{phase}{error}  |  PROTOCOL {major}.{minor}  |  {feature_flag}",
  "loading_roster": "SLOT 1  —  LOADING\n\nSLOT 2  —  LOADING",
  "populated_slot_template": "SLOT {ordinal}  —  HERO {ordinal}{selected}\n  {class_name}  |  LEVEL {level}  |  OATH: NONE\n  SAFE — CHARACTER SELECT  |  LAST PLAYED: NEVER  |  ITEM POWER: {not_equipped}",
  "empty_slot_template": "SLOT {ordinal}  —  EMPTY\n  Create a wipeable {class_name} character.",
  "selected_badge": "  [SELECTED]",
  "class_detail_template": "{class_name}\nLOCKED BASE SILHOUETTE — NO APPEARANCE ENTITLEMENT\nOATH: UNLOCKS AT LEVEL 10\nITEM POWER: {not_equipped}\nPREVIEW I / II: {unavailable}",
  "create_action": "[ENTER] CREATE CHARACTER",
  "select_slot_action_template": "[{ordinal}] SELECT SLOT {ordinal}",
  "retry_action": "[R] RETRY",
  "footer_template": "PLAY — {unavailable}\nAccessibility: keyboard and pointer actions share the same authoritative commands.",
  "closed_feature_literal": "AVAILABLE IN A LATER TEST",
  "not_equipped_literal": "NOT EQUIPPED"
}
